{
  "tc_id": "TC-017",
  "tc_name": "Laboratory Shift Table",
  "metadata": {
    "n_total": 200,
    "n_experimental": 100,
    "n_control": 100,
    "population": "SAFETY",
    "lab_test": "Hemoglobin",
    "lab_unit": "g/L",
    "categories": [
      "LOW",
      "NORMAL",
      "HIGH"
    ],
    "thresholds": {
      "low": 120,
      "high": 160
    },
    "n_post_baseline_visits": 3,
    "python_version": "3.9.6"
  },
  "shift_overall": {
    "counts": {
      "LOW": {
        "LOW": 3,
        "NORMAL": 21,
        "HIGH": 1
      },
      "NORMAL": {
        "LOW": 16,
        "NORMAL": 132,
        "HIGH": 5
      },
      "HIGH": {
        "LOW": 1,
        "NORMAL": 17,
        "HIGH": 4
      }
    },
    "percentages": {
      "LOW": {
        "LOW": 1.5,
        "NORMAL": 10.5,
        "HIGH": 0.5
      },
      "NORMAL": {
        "LOW": 8.0,
        "NORMAL": 66.0,
        "HIGH": 2.5
      },
      "HIGH": {
        "LOW": 0.5,
        "NORMAL": 8.5,
        "HIGH": 2.0
      }
    },
    "n_total": 200,
    "n_stable_normal": 132,
    "n_low_to_normal": 21,
    "n_normal_to_low": 16,
    "n_normal_to_high": 5,
    "n_high_to_normal": 17
  },
  "shift_experimental": {
    "counts": {
      "LOW": {
        "LOW": 1,
        "NORMAL": 9,
        "HIGH": 1
      },
      "NORMAL": {
        "LOW": 6,
        "NORMAL": 69,
        "HIGH": 4
      },
      "HIGH": {
        "LOW": 1,
        "NORMAL": 9,
        "HIGH": 0
      }
    },
    "percentages": {
      "LOW": {
        "LOW": 1.0,
        "NORMAL": 9.0,
        "HIGH": 1.0
      },
      "NORMAL": {
        "LOW": 6.0,
        "NORMAL": 69.0,
        "HIGH": 4.0
      },
      "HIGH": {
        "LOW": 1.0,
        "NORMAL": 9.0,
        "HIGH": 0.0
      }
    },
    "n_total": 100,
    "n_stable_normal": 69,
    "n_low_to_normal": 9,
    "n_normal_to_low": 6,
    "n_normal_to_high": 4,
    "n_high_to_normal": 9
  },
  "shift_control": {
    "counts": {
      "LOW": {
        "LOW": 2,
        "NORMAL": 12,
        "HIGH": 0
      },
      "NORMAL": {
        "LOW": 10,
        "NORMAL": 63,
        "HIGH": 1
      },
      "HIGH": {
        "LOW": 0,
        "NORMAL": 8,
        "HIGH": 4
      }
    },
    "percentages": {
      "LOW": {
        "LOW": 2.0,
        "NORMAL": 12.0,
        "HIGH": 0.0
      },
      "NORMAL": {
        "LOW": 10.0,
        "NORMAL": 63.0,
        "HIGH": 1.0
      },
      "HIGH": {
        "LOW": 0.0,
        "NORMAL": 8.0,
        "HIGH": 4.0
      }
    },
    "n_total": 100,
    "n_stable_normal": 63,
    "n_low_to_normal": 12,
    "n_normal_to_low": 10,
    "n_normal_to_high": 1,
    "n_high_to_normal": 8
  }
}